{
  "$schema": "./catalog.schema.json",
  "schema_version": "1.1.0",
  "catalog_version": "1.7.0",
  "reviewed_on": "2026-08-16",
  "pilot_ids": [
    "INT-01",
    "INF-01",
    "COM-01",
    "ENG-01",
    "CORE-01",
    "WORK-01",
    "WORK-05"
  ],
  "inspection_defaults": {
    "viewports": [
      {
        "id": "wide",
        "label": "Wide",
        "width": 1180,
        "height": 760
      },
      {
        "id": "narrow",
        "label": "Narrow",
        "width": 390,
        "height": 844
      }
    ],
    "themes": [
      {
        "id": "light",
        "label": "Light",
        "theme": "light",
        "contrast": "normal"
      },
      {
        "id": "dark",
        "label": "Dark",
        "theme": "dark",
        "contrast": "normal"
      },
      {
        "id": "light-high-contrast",
        "label": "Light high contrast",
        "theme": "light",
        "contrast": "more"
      },
      {
        "id": "dark-high-contrast",
        "label": "Dark high contrast",
        "theme": "dark",
        "contrast": "more"
      }
    ]
  },
  "presentation_status_definitions": {
    "planned": "The scenario is mapped to governing sources but has no checked Atlas presentation.",
    "linked": "The Atlas names the scenario and links an existing deterministic reference.",
    "showcased": "A dedicated Atlas presentation exposes checked state, viewport, and theme controls."
  },
  "known_gaps": [
    "Simplified Chinese Atlas and Lab copy is a non-normative presentation layer over the English canonical catalog; language-specific assistive-technology review remains open.",
    "Motion follows each reference and the user motion preference; the Atlas does not claim a separate scenario motion control."
  ],
  "scenarios": [
    {
      "id": "INT-01",
      "canonical_name": "Entity Database Review",
      "group": "intelligence",
      "product_profiles": [
        "intelligence-workspace"
      ],
      "wave": "P0",
      "user_job": "Select an entity, inspect evidence and properties, and make a reversible decision.",
      "entry": "An analyst opens a saved entity view or deep link.",
      "completion": "The analyst records or exits a review decision without losing list context.",
      "composition": {
        "first_meaningful_view": "Entity list or current entity with evidence.",
        "dominant_region": "Entity list and selected detail.",
        "persistent_context": "Entity identity, filters, source time, and review state."
      },
      "contract_paths": [
        "patterns/intelligence-workspace.md"
      ],
      "page_ids": [
        "intelligence-workspace"
      ],
      "source_maturity": "stable",
      "conditional": false,
      "presentation_status": "showcased",
      "reference_path": "examples/workspace-reference/index.html",
      "states": [
        "normal"
      ],
      "viewports": [
        "wide",
        "narrow"
      ],
      "themes": [
        "light",
        "dark",
        "light-high-contrast",
        "dark-high-contrast"
      ],
      "known_gaps": [
        "Selection changes and review decisions are interactive but are not URL-addressable fixtures yet."
      ],
      "inspection_path": "site/scenarios/lab.html?scenario=INT-01",
      "state_controls": [
        {
          "state": "normal",
          "label": "Selected entity review",
          "reference_path": "examples/workspace-reference/index.html?lang=en",
          "assertion": {
            "kind": "visible",
            "selector": ".entity-content"
          }
        }
      ]
    },
    {
      "id": "INT-02",
      "canonical_name": "Investigation and Evidence Review",
      "group": "intelligence",
      "product_profiles": [
        "intelligence-workspace"
      ],
      "wave": "P1",
      "user_job": "Compare chronology, sources, conflicts, and uncertainty before recording a finding.",
      "entry": "An analyst opens an entity investigation from a queue or direct URL.",
      "completion": "The analyst records an attributable finding or leaves the investigation unchanged.",
      "composition": {
        "first_meaningful_view": "Entity identity with chronology and evidence.",
        "dominant_region": "Evidence and event chronology.",
        "persistent_context": "Entity, source attribution, verification state, and current finding."
      },
      "contract_paths": [
        "patterns/intelligence-workspace.md"
      ],
      "page_ids": [
        "intelligence-workspace"
      ],
      "source_maturity": "stable",
      "conditional": false,
      "presentation_status": "showcased",
      "reference_path": "examples/workspace-reference/index.html",
      "states": [
        "normal",
        "loading",
        "partial",
        "conflict",
        "stale",
        "empty",
        "pending",
        "committed",
        "undo",
        "permission",
        "error"
      ],
      "viewports": [
        "wide",
        "narrow"
      ],
      "themes": [
        "light",
        "dark",
        "light-high-contrast",
        "dark-high-contrast"
      ],
      "known_gaps": [
        "The deterministic reference has no live sources, authoritative permission service, durable finding record, or production investigation data.",
        "Manual screen-reader, browser-zoom, and physical touch-device review remain outside the Atlas evidence."
      ],
      "inspection_path": "site/scenarios/lab.html?scenario=INT-02",
      "state_controls": [
        {
          "state": "normal",
          "label": "Attributable evidence chronology",
          "reference_path": "examples/workspace-reference/index.html?view=investigation&lang=en&state=normal",
          "assertion": {
            "kind": "attribute",
            "selector": "[data-investigation]",
            "attribute": "data-investigation-state",
            "value": "normal"
          }
        },
        {
          "state": "loading",
          "label": "Refreshing evidence with context retained",
          "reference_path": "examples/workspace-reference/index.html?view=investigation&lang=en&state=loading",
          "assertion": {
            "kind": "visible",
            "selector": "[data-investigation-loading]"
          }
        },
        {
          "state": "partial",
          "label": "Incomplete source set",
          "reference_path": "examples/workspace-reference/index.html?view=investigation&lang=en&state=partial",
          "assertion": {
            "kind": "visible",
            "selector": "[data-investigation-partial]"
          }
        },
        {
          "state": "conflict",
          "label": "Conflicting source conclusions",
          "reference_path": "examples/workspace-reference/index.html?view=investigation&lang=en&state=conflict",
          "assertion": {
            "kind": "visible",
            "selector": "[data-investigation-conflict]"
          }
        },
        {
          "state": "stale",
          "label": "Evidence outside verification window",
          "reference_path": "examples/workspace-reference/index.html?view=investigation&lang=en&state=stale",
          "assertion": {
            "kind": "visible",
            "selector": "[data-investigation-stale]"
          }
        },
        {
          "state": "empty",
          "label": "Empty evidence scope",
          "reference_path": "examples/workspace-reference/index.html?view=investigation&lang=en&state=empty",
          "assertion": {
            "kind": "visible",
            "selector": "[data-investigation-empty]"
          }
        },
        {
          "state": "pending",
          "label": "Finding recording",
          "reference_path": "examples/workspace-reference/index.html?view=investigation&lang=en&state=pending",
          "assertion": {
            "kind": "visible",
            "selector": "[data-investigation-pending]"
          }
        },
        {
          "state": "committed",
          "label": "Attributable finding recorded",
          "reference_path": "examples/workspace-reference/index.html?view=investigation&lang=en&state=committed",
          "assertion": {
            "kind": "visible",
            "selector": "[data-investigation-committed]"
          }
        },
        {
          "state": "undo",
          "label": "Finding undone with draft retained",
          "reference_path": "examples/workspace-reference/index.html?view=investigation&lang=en&state=undo",
          "assertion": {
            "kind": "visible",
            "selector": "[data-investigation-undo]"
          }
        },
        {
          "state": "permission",
          "label": "View-only investigation",
          "reference_path": "examples/workspace-reference/index.html?view=investigation&lang=en&state=permission",
          "assertion": {
            "kind": "visible",
            "selector": "[data-investigation-permission]"
          }
        },
        {
          "state": "error",
          "label": "Failed finding with draft preserved",
          "reference_path": "examples/workspace-reference/index.html?view=investigation&lang=en&state=error",
          "assertion": {
            "kind": "visible",
            "selector": "[data-investigation-error]"
          }
        }
      ]
    },
    {
      "id": "INT-03",
      "canonical_name": "Risk Queue Review",
      "group": "intelligence",
      "product_profiles": [
        "intelligence-workspace"
      ],
      "wave": "P1",
      "user_job": "Triage a signal, preserve semantic separation, and assign or resolve review.",
      "entry": "An analyst opens a risk queue with a saved scope.",
      "completion": "The signal has an owner, reversible decision, and recorded reason.",
      "composition": {
        "first_meaningful_view": "Prioritized signal queue with evidence state.",
        "dominant_region": "Actionable risk queue.",
        "persistent_context": "Queue scope, signal severity, evidence state, owner, and review status."
      },